{
  "$schema": "http://json-schema.org/draft-07/schema#",
  "$id": "https://w-model-dev/schemas/tla-manifest.schema.json",
  "title": "TlaManifest",
  "description": "TLA+ manifest 结构 schema，对应 tla-logic.ts TlaManifest（层次化状态机建模规格清单）",
  "type": "object",
  "additionalProperties": false,
  "required": ["version", "currentPhase", "tools", "specs"],
  "allOf": [
    {
      "if": { "properties": { "currentPhase": { "type": "integer", "minimum": 2 } }, "required": ["currentPhase"] },
      "then": {
        "required": ["sdCoverage"],
        "properties": { "sdCoverage": {} }
      }
    }
  ],
  "properties": {
    "version": { "description": "TLA+ manifest schema 版本，当前固定为 1", "type": "number" },
    "project": { "description": "项目 ID（与 project.json 一致）", "type": "string" },
    "currentPhase": { "description": "当前所处阶段编号，取值 1-8", "type": "integer", "minimum": 1, "maximum": 8 },
    "basePath": {
      "description": "路径解析基准（强制必填，P1.1）：相对 manifest 文件所在目录，jarPath/tlaPath/cfgPath 均基于此解析（tla-plus.md §2.1）",
      "type": "string",
      "minLength": 1
    },
    "tools": {
      "description": "TLA+ 工具链配置（SANY/TLC 依赖 Java 运行时 + tla2tools.jar）",
      "type": "object",
      "additionalProperties": false,
      "required": ["jarPath", "javaMinVersion"],
      "properties": {
        "jarPath": {
          "description": "tla2tools.jar 路径（相对 basePath 解析；SANY 语法检查与 TLC 模型检查均依赖此 jar）",
          "type": "string",
          "minLength": 1
        },
        "javaMinVersion": {
          "description": "Java 最低版本号（默认 11；运行 tla2tools.jar 所需）",
          "type": "integer",
          "minimum": 1
        }
      }
    },
    "specs": {
      "description": "TLA+ 规格列表（层次化状态机建模规格清单，S 子代理产出 .tla/.cfg 后同步更新）",
      "type": "array",
      "items": {
        "description": "单个 TLA+ spec 条目（TlaSpec：模块 ID + 层级 + 文件引用 + 真实检查结果旗标）",
        "type": "object",
        "additionalProperties": false,
        "required": [
          "id",
          "level",
          "phase",
          "system",
          "requirementIds",
          "designRef",
          "tlaPath",
          "cfgPath",
          "parent",
          "siblings",
          "children",
          "variableCombination",
          "decompositionDecision",
          "syntaxChecked",
          "tlcChecked",
          "deadlockFree",
          "invariantsHold",
          "stateExplosion"
        ],
        "properties": {
          "id": {
            "description": "规格 ID（MODULE 名格式 L<level>_<system>[_<subsystem>]，须符合 §2.0 命名规范，禁止连字符）",
            "type": "string",
            "minLength": 1
          },
          "level": {
            "description": "规格层级：L1=系统内外交互 / L2=子系统 / L3=原子行为 / L4-L6=更深层次分解",
            "enum": ["L1", "L2", "L3", "L4", "L5", "L6"]
          },
          "phase": { "description": "产出阶段编号，取值 1-8", "type": "integer", "minimum": 1, "maximum": 8 },
          "system": {
            "description": "所属系统名称（层次路径用 :: 分隔，如 blog-system::auth-subsystem）",
            "type": "string",
            "minLength": 1
          },
          "requirementIds": {
            "description": "关联需求 ID 列表（与 rtm.json 需求 ID 一致，须登记于 RTM）",
            "type": "array",
            "items": { "type": "string", "minLength": 1 }
          },
          "designRef": {
            "description": "关联设计文档相对路径（可带锚点 #§，如 docs/outline-design.md#§3）",
            "type": "string"
          },
          "tlaPath": {
            "description": ".tla 文件路径（相对 manifest 文件所在目录解析，见 §2.1）",
            "type": "string",
            "minLength": 1
          },
          "cfgPath": {
            "description": ".cfg 文件路径（相对 manifest 文件所在目录解析，见 §2.1）",
            "type": "string",
            "minLength": 1
          },
          "parent": {
            "description": "上级 TLA 文件相对路径（相对该 .tla 文件所在目录解析；L1 填 null）",
            "type": ["string", "null"]
          },
          "siblings": {
            "description": "同级 TLA 文件相对路径列表（无填 []；与文件头 @sibling 双向一致）",
            "type": "array",
            "items": { "type": "string" }
          },
          "children": {
            "description": "下级 TLA 文件相对路径列表（叶子填 []；与文件头 @child 双向一致）",
            "type": "array",
            "items": { "type": "string" }
          },
          "variableCombination": {
            "description": "变量组合数（各变量取值域笛卡尔积），非负数值；>1000 考虑拆解、>10000 必须拆解",
            "type": "number",
            "minimum": 0
          },
          "decompositionDecision": {
            "description": "拆解决策：kept-below-threshold=组合数低于阈值不拆 / consider-split=>1000 考虑拆解（保留须声明理由）/ must-split=>10000 必须拆解 / split-done=已拆解完成；variableCombination>10000 时必须 split-done",
            "enum": ["must-split", "consider-split", "kept-below-threshold", "split-done"]
          },
          "variableCombinationBasis": {
            "description": "推导注记（B9，可选；variableCombination>1000 且保留未拆 kept-below-threshold 时必填）：各变量 {name, cardinality} 列表，Πcardinality 必须等于声明的 variableCombination 字段值，且名集合须覆盖 .tla VARIABLES 声明的全部状态变量（I5 起实现）；缺失 / 基数非法（非 ≥1 整数）/ 乘积不符 / 缺变量名均被 check-tla-model 判 violation；≤1000 不要求",
            "type": "object",
            "additionalProperties": false,
            "required": ["variables"],
            "properties": {
              "variables": {
                "description": "参与组合数计算的变量列表（至少 1 项；名集合须覆盖 .tla 声明的全部状态变量——声明集可提取时比对，提不到则跳过名比对）",
                "type": "array",
                "minItems": 1,
                "items": {
                  "description": "单个变量的取值基数声明",
                  "type": "object",
                  "additionalProperties": false,
                  "required": ["name", "cardinality"],
                  "properties": {
                    "name": {
                      "description": "变量名（与 .tla 文件 VARIABLES 声明一致）",
                      "type": "string",
                      "minLength": 1
                    },
                    "cardinality": {
                      "description": "变量取值基数（取值域大小，≥1 的整数；全部变量基数之积须等于 variableCombination）",
                      "type": "integer",
                      "minimum": 1
                    }
                  }
                }
              }
            }
          },
          "syntaxChecked": {
            "description": "SANY 语法检查是否通过（须为真实 SANY 运行结果，禁止占位/简化，反模式 #16）",
            "type": "boolean"
          },
          "tlcChecked": {
            "description": "TLC 模型检查是否通过（须为真实 TLC 运行结果；--skip-tlc 已移除，所有 specs 强制 TLC）",
            "type": "boolean"
          },
          "deadlockFree": { "description": "是否无死锁（真实 TLC 检查结果）", "type": "boolean" },
          "invariantsHold": { "description": "不变式是否成立（真实 TLC 检查结果）", "type": "boolean" },
          "stateExplosion": { "description": "是否发生状态爆炸（真实 TLC 运行结果）", "type": "boolean" },
          "lastCheckTimestamp": {
            "description": "最近一次校验时间戳（可选；G 子代理执行 check-tla-model.ts 后回填）",
            "type": "string"
          },
          "tlaContent": {
            "description": ".tla 文件文本内容（可选；CLI 读取后注入，供 cfg-tla 一致性等纯逻辑校验使用）",
            "type": "string"
          },
          "cfgContent": {
            "description": ".cfg 文件文本内容（可选；CLI 读取后注入，供 cfg 结构/一致性纯逻辑校验使用）",
            "type": "string"
          }
        }
      }
    },
    "graphSdNodes": {
      "description": "graph.json 中所有 type=SD 节点的 ID 列表（可选；CLI 通过 --graph 提取后注入，供 SD 覆盖率纯逻辑校验使用；未提供时跳过覆盖率校验）",
      "type": "array",
      "items": { "type": "string" }
    },
    "sdCoverage": {
      "description": "SD 覆盖率数据（phase>=2 强制必填，由 S-ingest-tla 从 .tla @designIds + graph.json 比对后回填）",
      "type": "object",
      "additionalProperties": false,
      "required": ["totalSdNodes", "coveredSdNodes", "uncoveredSdNodes", "coverageRate"],
      "properties": {
        "totalSdNodes": { "description": "graph.json 中 type=SD 节点总数", "type": "integer", "minimum": 0 },
        "coveredSdNodes": {
          "description": "已被 TLA+ spec 覆盖的 SD 节点 ID 列表",
          "type": "array",
          "items": { "type": "string" }
        },
        "uncoveredSdNodes": {
          "description": "未被任何 TLA+ spec 覆盖的 SD 节点 ID 列表（phase>=2 须为空数组，由业务层 checkTlaModel 校验）",
          "type": "array",
          "items": { "type": "string" }
        },
        "coverageRate": {
          "description": "覆盖率 = coveredSdNodes.length / totalSdNodes",
          "type": "number",
          "minimum": 0,
          "maximum": 1
        }
      }
    },
    "checkRounds": {
      "description": "TLA+ 校验轮次记录数组（spec 级记录，语义见 tla-plus.md「checkRounds 字段语义」；首次产出 TLA+ 前填 []；禁止 phase 级摘要字段，违反 R13 拦截）",
      "type": "array",
      "items": {
        "description": "单轮 TLA+ 校验记录（CheckRound：spec 级返工记录项，字段语义见 tla-plus.md「checkRounds 字段语义」；未知字段一律拒绝，phase 级摘要字段另受 tla-logic R13 禁止）",
        "type": "object",
        "additionalProperties": false,
        "required": ["phase", "round", "specId", "syntaxCheck", "tlcCheck", "violations", "converged"],
        "properties": {
          "phase": { "description": "校验时所处阶段编号，取值 1-8", "type": "integer", "minimum": 1, "maximum": 8 },
          "round": { "description": "本阶段内校验轮次序号（从 1 起）", "type": "integer", "minimum": 1 },
          "timestamp": { "description": "校验时间戳（ISO 8601 字符串）", "type": "string" },
          "specId": { "description": "校验的 spec id（引用 specs[].id）", "type": "string", "minLength": 1 },
          "syntaxCheck": { "description": "本轮 SANY 语法检查是否通过（真实 SANY 运行结果）", "type": "boolean" },
          "tlcCheck": { "description": "本轮 TLC 模型检查是否通过（真实 TLC 运行结果）", "type": "boolean" },
          "violations": {
            "description": "本轮违反详情列表（死锁 + 不变式违反 + 状态爆炸等合计，每条为具体违反描述）",
            "type": "array",
            "items": { "type": "string" }
          },
          "converged": { "description": "本轮是否零违反收敛（violations.length === 0）", "type": "boolean" }
        }
      }
    }
  }
}
