{
  "version": 1,
  "project": "tla-sample-valid",
  "currentPhase": 2,
  "basePath": ".",
  "tools": {
    "jarPath": "w-model-dev/tools/tla2tools.jar",
    "javaMinVersion": 11
  },
  "specs": [
    {
      "id": "L1-system",
      "level": "L1",
      "phase": 1,
      "system": "sample-system",
      "requirementIds": ["REQ-001"],
      "designRef": "docs/requirement-spec.md#§3",
      "tlaPath": "tla/L1-system.tla",
      "cfgPath": "tla/L1-system.cfg",
      "parent": null,
      "siblings": [],
      "children": ["tla/L2-auth.tla"],
      "variableCombination": 240,
      "decompositionDecision": "kept-below-threshold",
      "syntaxChecked": true,
      "tlcChecked": true,
      "deadlockFree": true,
      "invariantsHold": true,
      "stateExplosion": false
    },
    {
      "id": "L2-auth",
      "level": "L2",
      "phase": 2,
      "system": "sample-system::auth",
      "requirementIds": ["REQ-001"],
      "designRef": "docs/system-design.md#§3.2",
      "tlaPath": "tla/L2-auth.tla",
      "cfgPath": "tla/L2-auth.cfg",
      "parent": "tla/L1-system.tla",
      "siblings": [],
      "children": [],
      "variableCombination": 80,
      "decompositionDecision": "kept-below-threshold",
      "syntaxChecked": true,
      "tlcChecked": true,
      "deadlockFree": true,
      "invariantsHold": true,
      "stateExplosion": false
    }
  ],
  "checkRounds": []
}
