{
  "version": 1,
  "project": "tla-e2e-counter-pass",
  "currentPhase": 1,
  "basePath": ".",
  "tools": {
    "jarPath": "../../../tools/tla2tools.jar",
    "javaMinVersion": 11
  },
  "specs": [
    {
      "id": "L1-counter",
      "level": "L1",
      "phase": 1,
      "system": "smoketest",
      "requirementIds": [],
      "designRef": "",
      "tlaPath": "Counter.tla",
      "cfgPath": "Counter.cfg",
      "parent": null,
      "siblings": [],
      "children": [],
      "variableCombination": 11,
      "decompositionDecision": "kept-below-threshold",
      "syntaxChecked": false,
      "tlcChecked": false,
      "deadlockFree": false,
      "invariantsHold": false,
      "stateExplosion": false
    }
  ],
  "checkRounds": []
}
