{
  "version": 1,
  "project": "tla-sample-valid-cfg-consistency",
  "currentPhase": 1,
  "basePath": ".",
  "tools": {
    "jarPath": "w-model-dev/tools/tla2tools.jar",
    "javaMinVersion": 11
  },
  "specs": [
    {
      "id": "L1-system",
      "level": "L1",
      "phase": 1,
      "system": "sample-system",
      "requirementIds": ["REQ-001"],
      "designRef": "docs/requirement-spec.md#§3",
      "tlaPath": "tla/L1-system.tla",
      "cfgPath": "tla/L1-system.cfg",
      "parent": null,
      "siblings": [],
      "children": [],
      "variableCombination": 240,
      "decompositionDecision": "kept-below-threshold",
      "syntaxChecked": true,
      "tlcChecked": true,
      "deadlockFree": true,
      "invariantsHold": true,
      "stateExplosion": false,
      "tlaContent": "---- MODULE L1System ----\nEXTENDS Naturals, Sequences\nVARIABLES state\nNoExitTerminal == state # \"terminal\"\nArtifactGateConsistency == state # \"artifact_gate\"\nBusinessInvariant == /\\ NoExitTerminal\n                      /\\ ArtifactGateConsistency\nSpec == Init /\\ [][Next]_state\n====",
      "cfgContent": "SPECIFICATION Spec\nINVARIANTS\n  NoExitTerminal\n  ArtifactGateConsistency"
    }
  ],
  "checkRounds": []
}
